{"id":"EVD-GEI-001","type":"evidence","title":"Water-management technology provides a comparative engineering context","status":"active","version":"1.0.9","evidence_level":"E3","claim_status":"neutral","statement":"Ancient societies developed irrigation and water-management technologies that provide a legitimate comparative context for evaluating hydraulic analogies.","observation":"Documented water-management practices can be compared functionally with proposed GEI mappings, but technological similarity alone does not establish textual dependence or authorial intent.","source_ids":["SRC-WTR-001"],"comparison_ids":["CMP-GEN-EGY-001"],"confidence":"C3","counterevidence_ids":[],"notes":"Comparative context, not proof of the Genesis interpretation."}